2021958,8451,caledonia beadlet anemone chu-like virus 1
2021957,8452,caledonia beadlet anemone nora virus-like virus 1
2021956,8453,barns ness beadlet anemone chu-like virus 1
2021926,8466,caledonia beadlet anemone sobemo-like virus 1
2021923,8469,barns ness beadlet anemone sobemo-like virus 1
2021922,8470,millport beadlet anemone noda-like virus 1
2021917,8475,millport beadlet anemone dicistro-like virus 1
2021910,8482,caledonia beadlet anemone dicistro-like virus 4
2021909,8483,caledonia beadlet anemone dicistro-like virus 3
2021908,8484,caledonia beadlet anemone dicistro-like virus 2
2021907,8485,caledonia beadlet anemone dicistro-like virus 1
2021906,8486,caledonia beadlet anemone tombus-like virus 1
2021897,8495,caledonia beadlet anemone parvo-like virus 1
2021886,8506,caledonia beadlet anemone picorna-like virus 2
2021885,8507,caledonia beadlet anemone picorna-like virus 1
2021876,8516,barns ness beadlet anemone picorna-like virus 1
1950126,17854,clematis chlorotic mottle virus,VHostDB
1883104,27924,adonis mosaic virus
1417308,75798,aquilegia virus
1260769,93440,ageratum enation alphasatellite,VHostDB
866672,127795,papaver enation virus
592207,148691,helleborus mosaic virus
592206,148692,helleborus net necrosis virus,VHostDB
570831,150363,delphinium vein-clearing virus
473784,162830,opium poppy mosaic virus,VHostDB
459305,164737,anemone mosaic virus
341113,176979,ranunculus latent virus
341112,176980,ranunculus mosaic virus
341111,176981,ranunculus mild mosaic virus
341110,176982,ranunculus leaf distortion virus
315713,178695,nandina mosaic virus,VHostDB
302838,179336,berberis potyvirus
152636,185842,ranunculus white mottle virus
136164,186338,nandina virus x
101764,187330,aconitum latent virus,VHostDB
12197,190040,bean yellow mosaic virus,VHostDB
